<?xml version="1.0" encoding="UTF-8"?>
<?xml-model href="treninkovyPlan.sch" type="application/xml" schematypens="http://purl.oclc.org/dsdl/schematron"?>
<trainingPlan xmlns="urn:nguyen:treninkovyPlan"
    xmlns:xsi="http://www.w3.org/2001/XMLSchema-instance"
    xsi:schemaLocation="urn:nguyen:treninkovyPlan treninkovyPlan.xsd">
    <person oid="1">
        <forename>Kevin</forename>
        <surname>Nguyen</surname>
        <age>20</age>
        <height>176</height>
        <weight>82</weight>
        <goal>lower body and maintain muscle mass</goal>
        <profession>student</profession>
        <frequencyInAWeek>6</frequencyInAWeek>
        <experience>1</experience>
        <givenPlan>
            <name>Le Mans</name>
        </givenPlan>
    </person>
    <person oid="2">
        <forename>Mark</forename>
        <surname>Kowalski</surname>
        <age>24</age>
        <height>172</height>
        <weight>68</weight>
        <goal>stay healthy</goal>
        <profession>employed</profession>
        <frequencyInAWeek>3</frequencyInAWeek>
        <experience>0.1</experience>
        <givenPlan>
            <name>Monaka</name>
        </givenPlan>
    </person>
    <plan pid="1">
        <name>Le Mans</name>
        <start>2024-04-29</start>
        <end>2024-05-05</end>
        <day date="2024-04-29">
            <training split="push">
                <exercise cid="1">
                    <name>Cable Lateral Raise</name>
                    <exercisePhoto src="exercises/cable_lateral_raise.png"/>
                    <muscles>Lateral Deltoid</muscles>
                    <musclesPhoto src="muscles/cable_lateral_raise.png"/>
                    <warmUp>
                        <series>2</series>
                        <reps>10</reps>
                    </warmUp>
                    <topSet>
                        <series>1</series>
                        <reps>10</reps>
                    </topSet>
                    <backOffSet>
                        <series>1</series>
                        <reps>10</reps>
                    </backOffSet>
                </exercise>
                <exercise cid="2">
                    <name>Dumbbell Shoulder Press</name>
                    <exercisePhoto src="exercises/dumbbell_shoulder_press.png"/>
                    <muscles>Front Deltoid</muscles>
                    <musclesPhoto src="muscles/dumbbell_shoulder_press.png"/>
                    <warmUp>
                        <series>1</series>
                        <reps>10</reps>
                    </warmUp>
                    <topSet>
                        <series>1</series>
                        <reps>10</reps>
                    </topSet>
                    <backOffSet>
                        <series>1</series>
                        <reps>10</reps>
                    </backOffSet>
                </exercise>
                <exercise cid="3">
                    <name>Dumbbell Rear Delt Fly</name>
                    <exercisePhoto src="exercises/dumbbell_rear_delt_fly.png"/>
                    <muscles>Rear Deltoid</muscles>
                    <musclesPhoto src="muscles/dumbbell_rear_delt_fly.png"/>
                    <warmUp>
                        <series>1</series>
                        <reps>10</reps>
                    </warmUp>
                    <topSet>
                        <series>1</series>
                        <reps>10</reps>
                    </topSet>
                    <backOffSet>
                        <series>1</series>
                        <reps>10</reps>
                    </backOffSet>
                </exercise>
                <exercise cid="4">
                    <name>Smith Machine Incline Bench Press</name>
                    <exercisePhoto src="exercises/smith_machine_incline_bench_press.png"/>
                    <muscles>Upper Chest</muscles>
                    <musclesPhoto src="muscles/smith_machine_incline_bench_press.png"/>
                    <warmUp>
                        <series>3</series>
                        <reps>10</reps>
                    </warmUp>
                    <topSet>
                        <series>1</series>
                        <reps>10</reps>
                    </topSet>
                    <backOffSet>
                        <series>1</series>
                        <reps>10</reps>
                    </backOffSet>
                </exercise>
                <exercise cid="5">
                    <name>Dumbbell Bench Press</name>
                    <exercisePhoto src="exercises/dumbbell_bench_press.png"/>
                    <muscles>Chest</muscles>
                    <musclesPhoto src="muscles/dumbbell_bench_press.png"/>
                    <warmUp>
                        <series>1</series>
                        <reps>10</reps>
                    </warmUp>
                    <topSet>
                        <series>1</series>
                        <reps>10</reps>
                    </topSet>
                    <backOffSet>
                        <series>1</series>
                        <reps>10</reps>
                    </backOffSet>
                </exercise>
                <exercise cid="6">
                    <name>Cable Chest Fly</name>
                    <exercisePhoto src="exercises/cable_chest_fly.png"/>
                    <muscles>Chest</muscles>
                    <musclesPhoto src="muscles/cable_chest_fly.png"/>
                    <warmUp>
                        <series>1</series>
                        <reps>10</reps>
                    </warmUp>
                    <topSet>
                        <series>1</series>
                        <reps>10</reps>
                    </topSet>
                    <backOffSet>
                        <series>1</series>
                        <reps>10</reps>
                    </backOffSet>
                </exercise>
                <exercise cid="7">
                    <name>Tricep Pushdown</name>
                    <exercisePhoto src="exercises/tricep_pushdown.png"/>
                    <muscles>Triceps</muscles>
                    <musclesPhoto src="muscles/tricep_pushdown.png"/>
                    <warmUp>
                        <series>2</series>
                        <reps>10</reps>
                    </warmUp>
                    <topSet>
                        <series>1</series>
                        <reps>10</reps>
                    </topSet>
                    <backOffSet>
                        <series>1</series>
                        <reps>10</reps>
                    </backOffSet>
                </exercise>
                <exercise cid="8">
                    <name>Overhead Tricep Extension Machine</name>
                    <exercisePhoto src="exercises/overhead_tricep_extension_machine.png"/>
                    <muscles>Triceps</muscles>
                    <musclesPhoto src="muscles/overhead_tricep_extension_machine.png"/>
                    <warmUp>
                        <series>2</series>
                        <reps>10</reps>
                    </warmUp>
                    <topSet>
                        <series>1</series>
                        <reps>10</reps>
                    </topSet>
                    <backOffSet>
                        <series>1</series>
                        <reps>10</reps>
                    </backOffSet>
                </exercise>
                <cardio>
                    <name>Treadmill Incline Walking</name>
                    <exercisePhoto src="exercises/treadmill_incline_walking.png"/>
                    <period>20</period>
                    <speed>5.5</speed>
                    <incline>10</incline>
                </cardio>
                <summary>
                    <estimatedTime>2</estimatedTime>
                    <quantity>8</quantity>
                    <primaryMuscle>Lateral Deltoid,</primaryMuscle>
                    <primaryMuscle>Front Deltoid,</primaryMuscle>
                    <primaryMuscle>Rear Deltoid,</primaryMuscle>
                    <primaryMuscle>Upper Chest,</primaryMuscle>
                    <primaryMuscle>Chest,</primaryMuscle>
                    <primaryMuscle>Triceps</primaryMuscle>
                    <musclesTargetedPhoto src="muscles/split_push.png"/>
                </summary>
            </training>
        </day>
        <day date="2024-04-30">
            <training split="pull">
                <exercise cid="9">
                    <name>Lat Pulldown Machine</name>
                    <exercisePhoto src="exercises/lat_pulldown_machine.png"/>
                    <muscles>Lats</muscles>
                    <musclesPhoto src="muscles/lat_pulldown_machine.png"/>
                    <warmUp>
                        <series>2</series>
                        <reps>10</reps>
                    </warmUp>
                    <topSet>
                        <series>1</series>
                        <reps>10</reps>
                    </topSet>
                    <backOffSet>
                        <series>1</series>
                        <reps>10</reps>
                    </backOffSet>
                </exercise>
                <exercise cid="10">
                    <name>Barbell Row</name>
                    <exercisePhoto src="exercises/barbell_row.png"/>
                    <muscles>Lats, Trapezius</muscles>
                    <musclesPhoto src="muscles/barbell_row.png"/>
                    <warmUp>
                        <series>1</series>
                        <reps>10</reps>
                    </warmUp>
                    <topSet>
                        <series>1</series>
                        <reps>10</reps>
                    </topSet>
                    <backOffSet>
                        <series>1</series>
                        <reps>10</reps>
                    </backOffSet>
                </exercise>
                <exercise cid="11">